{
 "delta_id": "GOLD-E13",
 "event_id": "E13",
 "document": {
  "id": "PER-11-PJ-2025",
  "title": "PER-11/PJ/2025: Pembulatan PPh 21 pada bukti potong ke rupiah penuh terdekat mulai Masa Januari 2025 (bagian dari ketentuan pelaporan Coretax)",
  "issued": "2025-05-22"
 },
 "relevant": true,
 "add": [
  {
   "kind": "parameter",
   "id": "PAR.PPH_ROUND_MODE.2025",
   "name": "pph_round_mode",
   "value": "half_up",
   "value_type": "category",
   "valid_from": "2025-01-01",
   "label_id": "pembulatan PPh Pasal 21 masa",
   "source": [
    {
     "document": "PER-11-PJ-2025",
     "provision": "Pasal 129 ayat (1)",
     "page": 106,
     "quote": "diisi dengan pembulatan ke dalam rupiah penuh."
    },
    {
     "document": "PER-11-PJ-2025",
     "provision": "Pasal 129 ayat (3) huruf b",
     "page": 106,
     "quote": "b. sama dengan atau lebih dari 0,50 (nol koma lima"
    },
    {
     "document": "PER-11-PJ-2025",
     "provision": "Pasal 129 ayat (3) huruf b",
     "page": 106,
     "quote": "nol), maka bilangan tersebut dibulatkan ke atas."
    },
    {
     "document": "PER-11-PJ-2025",
     "provision": "Pasal 130 huruf a",
     "page": 107,
     "quote": "dengan Masa Pajak Desember 2024, oleh Pemotong Pajak"
    }
   ],
   "recorded_on": "2025-05-22"
  }
 ],
 "change": [],
 "remove": [],
 "note": ""
}
