{
 "delta_id": "GOLD-SP05",
 "event_id": null,
 "document": {
  "id": "SP05",
  "title": "PT Benang Sutra Lestari: Perjanjian Kerja Bersama",
  "issued": "2024-07-01"
 },
 "relevant": true,
 "add": [
  {
   "kind": "rule",
   "id": "PRS.SP05.JKK_RATE",
   "layer": "company",
   "modality": "default",
   "scope": "period",
   "produces": "jkk_rate",
   "expression": "dec('0.0054')",
   "valid_from": "2024-07-01",
   "valid_until": "2026-06-30",
   "label": "JKK rate written as a fixed number",
   "policy": "SP05",
   "conflict_code": "C6",
   "source": [
    {
     "document": "SP05",
     "provision": "Pasal 45 ayat (2)",
     "page": 1,
     "quote": "Iuran JKK ditetapkan sebesar 0,54% (nol koma lima puluh empat persen)"
    },
    {
     "document": "SP05",
     "provision": "Pasal 67 ayat (1)",
     "page": 1,
     "quote": "berlaku sejak tanggal 1 Juli 2024 sampai dengan tanggal 30 Juni 2026"
    }
   ],
   "recorded_on": "2024-07-01"
  },
  {
   "kind": "rule",
   "id": "PRS.SP05.METHOD",
   "layer": "company",
   "modality": "default",
   "scope": "year",
   "produces": "withholding_method",
   "expression": "'gross'",
   "valid_from": "2024-07-01",
   "valid_until": "2026-06-30",
   "label": "withholding method stated by the policy: gross",
   "policy": "SP05",
   "source": [
    {
     "document": "SP05",
     "provision": "Pasal 47",
     "page": 1,
     "quote": "dipotong dari upah pekerja setiap bulan"
    },
    {
     "document": "SP05",
     "provision": "Pasal 67 ayat (1)",
     "page": 1,
     "quote": "berlaku sejak tanggal 1 Juli 2024 sampai dengan tanggal 30 Juni 2026"
    }
   ],
   "recorded_on": "2024-07-01"
  }
 ],
 "change": [],
 "remove": [],
 "note": ""
}
