{
 "delta_id": "GOLD-SP13",
 "event_id": null,
 "document": {
  "id": "SP13",
  "title": "PT Kencana Pelayaran Nusantara: Perjanjian Kerja Bersama",
  "issued": "2023-06-01"
 },
 "relevant": true,
 "add": [
  {
   "kind": "rule",
   "id": "PRS.SP13.METHOD",
   "layer": "company",
   "modality": "default",
   "scope": "year",
   "produces": "withholding_method",
   "expression": "'employer_borne'",
   "valid_from": "2023-06-01",
   "valid_until": "2025-05-31",
   "label": "withholding method stated by the policy: employer_borne",
   "policy": "SP13",
   "source": [
    {
     "document": "SP13",
     "provision": "Pasal 61 ayat (1)",
     "page": 1,
     "quote": "ditanggung sepenuhnya oleh Perusahaan"
    },
    {
     "document": "SP13",
     "provision": "Pasal 82 ayat (1)",
     "page": 1,
     "quote": "berlaku sejak tanggal 1 Juni 2023 sampai dengan tanggal 31 Mei 2025"
    }
   ],
   "recorded_on": "2023-06-01"
  },
  {
   "kind": "rule",
   "id": "PRS.SP13.JKK_RATE",
   "layer": "company",
   "modality": "default",
   "scope": "period",
   "produces": "jkk_rate",
   "expression": "dec('0.0127')",
   "valid_from": "2023-06-01",
   "valid_until": "2025-05-31",
   "label": "JKK rate written as a fixed number",
   "policy": "SP13",
   "conflict_code": "C6",
   "source": [
    {
     "document": "SP13",
     "provision": "Pasal 62",
     "page": 1,
     "quote": "Iuran JKK sebesar 1,27% (satu koma dua puluh tujuh persen)"
    },
    {
     "document": "SP13",
     "provision": "Pasal 82 ayat (1)",
     "page": 1,
     "quote": "berlaku sejak tanggal 1 Juni 2023 sampai dengan tanggal 31 Mei 2025"
    }
   ],
   "recorded_on": "2023-06-01"
  }
 ],
 "change": [],
 "remove": [],
 "note": "Pasal 60 (crew mess) defers to the tax rules ('sepanjang sesuai ketentuan perpajakan') and is not encoded."
}
