{
 "delta_id": "GOLD-SP06",
 "event_id": null,
 "document": {
  "id": "SP06",
  "title": "PT Mitra Niaga Sandang: Perjanjian Kerja Bersama",
  "issued": "2025-01-01"
 },
 "relevant": true,
 "add": [
  {
   "kind": "rule",
   "id": "PRS.SP06.METHOD",
   "layer": "company",
   "modality": "default",
   "scope": "year",
   "produces": "withholding_method",
   "expression": "'gross_up'",
   "valid_from": "2025-01-01",
   "valid_until": "2026-12-31",
   "label": "withholding method stated by the policy: gross_up",
   "policy": "SP06",
   "source": [
    {
     "document": "SP06",
     "provision": "Pasal 33 ayat (1)",
     "page": 1,
     "quote": "sebesar Pajak Penghasilan Pasal 21 terutang atas penghasilan pekerja"
    },
    {
     "document": "SP06",
     "provision": "Pasal 33 ayat (2)",
     "page": 1,
     "quote": "dihitung dengan metode gross-up"
    },
    {
     "document": "SP06",
     "provision": "Pasal 53 ayat (1)",
     "page": 1,
     "quote": "berlaku sejak tanggal 1 Januari 2025 sampai dengan tanggal 31 Desember 2026"
    }
   ],
   "recorded_on": "2025-01-01"
  },
  {
   "kind": "rule",
   "id": "PRS.SP06.DTP_AS_ALLOWANCE",
   "layer": "company",
   "modality": "default",
   "scope": "period",
   "produces": "pph21_dtp",
   "expression": "0",
   "valid_from": "2025-01-01",
   "valid_until": "2026-12-31",
   "label": "DTP counted against the tax allowance; no cash payment to the employee",
   "policy": "SP06",
   "conflict_code": "C4",
   "source": [
    {
     "document": "SP06",
     "provision": "Pasal 33 ayat (3)",
     "page": 1,
     "quote": "diperhitungkan sebagai pemenuhan tunjangan sebagaimana dimaksud pada ayat (1) untuk Masa Pajak yang bersangkutan, dan Perusahaan tidak melakukan pembayaran tambahan"
    },
    {
     "document": "SP06",
     "provision": "Pasal 53 ayat (1)",
     "page": 1,
     "quote": "berlaku sejak tanggal 1 Januari 2025 sampai dengan tanggal 31 Desember 2026"
    }
   ],
   "recorded_on": "2025-01-01"
  }
 ],
 "change": [],
 "remove": [],
 "note": ""
}
