{
 "delta_id": "GOLD-D08",
 "event_id": "D08",
 "document": {
  "id": "PMK-110-PMK-03-2020",
  "title": "PMK 110/PMK.03/2020: Perubahan PMK 86/2020",
  "issued": "2020-08-14"
 },
 "relevant": false,
 "add": [],
 "change": [],
 "remove": [],
 "note": "PMK 110/2020 restates the PPh 21 DTP provisions and KLU list of PMK 86/2020; no PPh 21 calculation changes."
}
