{
 "delta_id": "GOLD-SP03",
 "event_id": null,
 "document": {
  "id": "SP03",
  "title": "PT Samudra Biru Hospitality: Perjanjian Kerja Bersama",
  "issued": "2025-03-01"
 },
 "relevant": true,
 "add": [
  {
   "kind": "rule",
   "id": "PRS.SP03.DTP_WITHHELD",
   "layer": "company",
   "modality": "default",
   "scope": "period",
   "produces": "pph21_dtp",
   "expression": "0",
   "valid_from": "2025-03-01",
   "valid_until": "2026-12-31",
   "label": "government-borne PPh 21 kept by the company, not paid to the employee",
   "policy": "SP03",
   "conflict_code": "C4",
   "source": [
    {
     "document": "SP03",
     "provision": "Pasal 40 ayat (3)",
     "page": 1,
     "quote": "diterima dan dikelola oleh Perusahaan untuk mendukung program kesejahteraan pekerja secara kolektif, dan tidak dibayarkan secara perorangan kepada pekerja"
    },
    {
     "document": "SP03",
     "provision": "Pasal 60 ayat (1)",
     "page": 1,
     "quote": "berlaku sejak tanggal 1 Maret 2025 sampai dengan tanggal 31 Desember 2026"
    }
   ],
   "recorded_on": "2025-03-01"
  },
  {
   "kind": "rule",
   "id": "PRS.SP03.METHOD",
   "layer": "company",
   "modality": "default",
   "scope": "year",
   "produces": "withholding_method",
   "expression": "'gross'",
   "valid_from": "2025-03-01",
   "valid_until": "2026-12-31",
   "label": "withholding method stated by the policy: gross",
   "policy": "SP03",
   "source": [
    {
     "document": "SP03",
     "provision": "Pasal 40 ayat (1)",
     "page": 1,
     "quote": "menjadi beban pekerja dan dipotong oleh Perusahaan setiap bulan"
    },
    {
     "document": "SP03",
     "provision": "Pasal 60 ayat (1)",
     "page": 1,
     "quote": "berlaku sejak tanggal 1 Maret 2025 sampai dengan tanggal 31 Desember 2026"
    }
   ],
   "recorded_on": "2025-03-01"
  }
 ],
 "change": [],
 "remove": [],
 "note": ""
}
