{
 "delta_id": "GOLD-E01",
 "event_id": "E01",
 "document": {
  "id": "BPJSTK-JP-2023",
  "title": "Surat BPJS TK B/77/022023: Batas upah iuran JP 2023: Rp9.559.600",
  "issued": "2023-02-27"
 },
 "relevant": true,
 "add": [
  {
   "kind": "parameter",
   "id": "PAR.JP_WAGE_CAP.2023",
   "name": "jp_wage_cap",
   "value": 9559600,
   "value_type": "money",
   "valid_from": "2023-03-01",
   "label_id": "batas upah tertinggi jaminan pensiun",
   "source": [
    {
     "document": "BPJSTK-JP-2023",
     "provision": "angka 4",
     "page": 1,
     "quote": "Batas paling tinggi Upah sebagai dasar perhitungan iuran Jaminan Pensiun mulai bulan"
    },
    {
     "document": "BPJSTK-JP-2023",
     "provision": "angka 4",
     "page": 1,
     "quote": "Maret 2023, dengan perhitungan:"
    },
    {
     "document": "BPJSTK-JP-2023",
     "provision": "angka 4",
     "page": 1,
     "quote": "Dibulatkan menjadi 9.559.600"
    }
   ],
   "recorded_on": "2023-02-27"
  }
 ],
 "change": [],
 "remove": [],
 "note": ""
}
